{
  "bundle_id": "CRA-2026-05-001",
  "schema_version": "0.1.0",
  "system": {
    "system_id": "CRD-SCORE-02",
    "name": "Retail credit application scorecard",
    "use_case": "Credit decisioning, section 8",
    "system_class": "continually_retrained",
    "autonomy_level": "human_in_loop",
    "impact_tier": "high"
  },
  "trigger_record": {
    "trigger_id": "TRG-2026-05-0141",
    "category": "A_performance_degradation",
    "materiality": "review_required",
    "detected_at": "2026-05-11T07:20:00Z",
    "detection_source": "automated_monitoring",
    "summary": "Calibration drift in the mid-risk band: predicted default rates diverged from realised rates over eight consecutive weeks."
  },
  "delta_description": {
    "summary": "Expected-to-actual default ratio moved from 1.02 to 1.19 in deciles 4 to 6. No model version change in the period; the shift tracks a change in applicant mix following a new broker channel.",
    "duration": "sustained",
    "change_records": [
      {
        "change_type": "retraining",
        "reference": "MLOPS-4471 scheduled monthly refresh",
        "applied_at": "2026-04-02T02:00:00Z"
      }
    ]
  },
  "reliability_impact_analysis": {
    "customer_financial_impact": "moderate",
    "compensating_controls": "partial",
    "assessment": "Mid-band applicants are being under-priced for risk. Exposure is bounded because the affected deciles represent 14 percent of approvals and manual underwriter review already applies above the referral threshold. Left uncorrected, the drift would compound as the broker channel grows.",
    "root_cause": "Applicant mix shift from the new broker channel introduced a segment under-represented in the training window, degrading calibration without materially affecting rank-order discrimination.",
    "metrics": [
      {
        "name": "expected_to_actual_default_ratio",
        "baseline": 1.02,
        "observed": 1.19,
        "threshold": 1.1,
        "breached": true
      },
      {
        "name": "gini",
        "baseline": 0.61,
        "observed": 0.59,
        "threshold": 0.55,
        "breached": false
      }
    ]
  },
  "monitoring_snapshot": {
    "captured_at": "2026-05-11T08:00:00Z",
    "monitoring_intact": true,
    "drift_indicators": [
      "population stability index 0.18 on applicant income band",
      "broker channel share up from 3 percent to 11 percent of volume"
    ],
    "override_rate": 0.12,
    "alert_history_reference": "MON-CRD-SCORE-02/2026-W15..W19",
    "notes": "Discrimination remains within tolerance; the failure is calibration, not ranking."
  },
  "decision_record": {
    "decision": "constrain",
    "recorded_escalation_level": 3,
    "rationale": "Rank-ordering still holds, so the scorecard retains value, but pricing on the affected deciles is no longer defensible. Narrow automated approval to deciles 1 to 3 and route deciles 4 to 6 to underwriter review until a recalibration is validated.",
    "temporary_controls": [
      "Automated approval suspended for deciles 4 to 6",
      "Underwriter review mandatory for the affected bands",
      "Weekly calibration reporting to the model risk forum"
    ],
    "decided_at": "2026-05-13T15:30:00Z",
    "governance_forum_notified": false
  },
  "ownership": {
    "business_owner": {
      "id": "u.hartley",
      "role_title": "Head of Retail Lending",
      "signed_off_at": "2026-05-13T15:30:00Z"
    },
    "technical_owner": {
      "id": "s.okafor",
      "role_title": "Lead Data Scientist, Credit Models",
      "signed_off_at": "2026-05-13T14:05:00Z"
    },
    "independent_control_owner": {
      "id": "j.nowak",
      "role_title": "Model Risk Manager",
      "signed_off_at": "2026-05-13T16:12:00Z"
    },
    "approver": {
      "id": "j.nowak",
      "role_title": "Model Risk Manager",
      "signed_off_at": "2026-05-13T16:12:00Z"
    }
  }
}
